"_SYSTEM_ID","Question External Id","Question Name"
"65f1a064d2bc56000784a706","SUR_TEST_001_1710334046973","Enter your First question"
"65f1a064d2bc56000784a70c","SUR_TEST_002_1710334046973","Enter your Second question"
"65f1a064d2bc56000784a712","SUR_TEST_003_1710334046973","Are you planning to come back?"
"65f1a064d2bc56000784a719","SUR_TEST_004_1710334046973","What type of device is available at home?"
"65f1a064d2bc56000784a71f","SUR_TEST_005_1710334046973","Does the child have a quiet place to study?"
"65f1a064d2bc56000784a725","SUR_TEST_006_1710334046973","Were you able to enroll your child in courses on Diksha?"
"65f1a064d2bc56000784a72c","SUR_TEST_007_1710334046973","What are the challenges that you are facing in enrolment?"